43,,,,Dynamic and Risk Measurement Perspectives on Bowman's Risk-Return Paradox for Strategic Management: An Empirical Study,"Bowman's (1980, 1982) widely quoted papers have reported the existence of a risk-return paradox for strategic management. In this paper the authors examine the dynamic behavior of the risk-return relationship and analyze whether the risk-return paradox is stable across time. The analysis involves tracking Bowman's so-called negative association ratio across time. Using accounting measures of risk and return, it is demonstrated that while the paradox holds during the 1970s, the finding does not hold in the environment of the 1960s. Further, the paradox disappears if market-based risk measures are used. Some implications for strategic management are then discussed and attention is directed towards the meaning of risk in the context of strategic management. In addition, possible explanations for this paradox are evaluated and directions for further research are suggested.",https://www.jstor.org/stable/2486056,Strategic Management Journal,10.2307_2486056,Management & Organizational Behavior,1986.0,0,1.5711004380136728e-05,0,0.0002726802777033299,0,0.00021653951262123883
44,,,,Welfare Effects from Non-Linear Taxation of Multiproduct Monopoly,This paper considers the ability of a non-linear tax to correct misallocation of resources in a monopolized market with a range of product qualities. If the monopolist pools several classes of consumers together then the quality tax will not achieve a first-best allocation.,https://www.jstor.org/stable/2487518,Managerial and Decision Economics,10.2307_2487518,Management & Organizational Behavior,1988.0,0,8.976800017990172e-06,0,0.00021514666150324047,0,0.0002471110492479056
45,,,,"Top Managerial Prestige, Power and Tender Offer Response: A Study of Elite Social Networks and Target Firm Cooperation during Takeovers","In this paper we explore the following research question: When faced with a tender offer, why do some firms resist and others cooperate? In the past, researchers have suggested that the manner in which firms respond to takeover attempts may be, in part, a function of managers' personal motivations. We contribute to this line of research by questioning whether other factors might be involved. Specifically, we examine whether cooperation may be a function of the friendliness of the bidding company and the social networks shared by executives in the two firms (i.e., bidder and target). We examine how the power and connections of managers affect their responses to tender offers. Our results suggest that these factors do indeed play a role. We found, for example, that target managers are more likely to cooperate under two conditions: (1) if they have less prestigious connections than managers in the bidding firm, and (2) if the target and bidding firms' share numerous ties to the same prestigious networks. In contrast, we found that target managers are more likely to resist a bidder's advances if: (1) the managers in both firms are poorly connected, or (2) the targets' managers hold more prestigious connections relative to the bidders. Together these findings suggest that cooperation and resistance may be a function of the social networks and power relationships that exist between and within firms. We discuss our findings within the framework of numerous organizational theories such as social class and social network theory, agency theory, and resource dependence. Although each of these perspectives suggests somewhat different results, we propose a reconciliation of these various perspectives. Specifically, we suggest that the variables of managerial power and connections may have different effects depending on whether we are observing firms before or after tender offers are made. It may be, for instance, that before a takeover offer is received, the power and prestige of target managers is associated with adoption of anti-takeover defenses (i.e., defenses designed to thwart takeover attempts). In fact, this finding has already been well documented in the literature. On the other hand, our findings suggest that after an offer is received, these same factors of prestige and power appear to be associated with resistance. Finally, our results call into question previous views that corporate takeovers are a mechanism for disciplining or ridding the company of incompetent managers. Instead, our findings suggest that the nature of the takeover process (i.e., cooperative versus resistant) may do little more than perpetuate existing social structures. Powerful and prestigious managers may not suffer the same negative effects of takeovers as their less prestigious and less powerful counterparts.",https://www.jstor.org/stable/2635197,Organization Science,10.2307_2635197,Management & Organizational Behavior,1993.0,0,3.003456185979303e-05,0,0.0004908204427920282,0,0.0011390427825972438
46,,,,Brownfield Acquisitions: A Reconceptualization and Extension,"Firms seeking specific complementary resources to pursue their growth strategy in emerging markets may use `brownfield' acquisitions to provide access to resources that are embedded in existing firms. This strategy requires a fundamental restructuring of the acquired firm to replace many of its resources and organizational structures. In this paper, we review the concept of brownfield acquisition, establish its empirical relevance outside of transition economies, explore its theoretical and empirical antecedents, and discuss its implications for theorizing in international business. Our empirical results based on a six-country survey in emerging markets show that brownfield acquisitions are most likely for projects that are more integrated with the parent's global operations, and where local firms are weak and institutions are strong. The concept provides a focal point for research on the resource-based view by illuminating the process of resource combination in firm growth. It also provides an example of where different aspects of the institutional framework may have contrary effects on various elements of business strategy.",https://www.jstor.org/stable/23012289,MIR: Management International Review,10.2307_23012289,Management & Organizational Behavior,2011.0,0,0.39701855182647705,0,0.004386212211102247,0,7.047201506793499e-05
47,,,,An Experimental Investigation of the Use of Computer-Based Graphics in Decision Making,"This paper presents the results of an experiment designed to investigate the impact of computer-based graphics on decision making. The experimental task consisted of selecting quarterly reorder quantities for an importer under condition of uncertain demand. Subjects in the experiment were participants in an executive program for middle and upper level managers. Each subject received information on the cumulative probability distribution of demand and had an opportunity to run up to eight trial simulations with past demand data using his or her order quantities. After completing the trial simulations, the subjects made quarterly ordering decisions for one year in which the quantities demanded were drawn from the demand distribution. Treatments included the use of a hard copy terminal and five different types of displays on a CRT. The results of the experiment provide limited support for the use of graphics presentation in an information system. Decision or cognitive style also appears to be an important variable influencing the performance of an individual and the reaction to an information system. The implications of the findings for the design of information systems are discussed.",https://www.jstor.org/stable/2630917,Management Science,10.2307_2630917,Management & Organizational Behavior,1981.0,0,5.873374902876094e-05,0,0.00044528587022796273,0,2.8578324418049306e-05
48,,,,Using the Case Survey Method to Analyze Policy Studies,"A common feature of most policy literatures is that the bulk of the empirical evidence is embodied in case studies. This presents a problem for subsequent analysis. Although each case study may provide rich insights into a specific situation, it is difficult to generalize about the studies as a whole. The following article describes one means of dealing with the problem: analyzing the content of case studies by using a closed-ended questionnaire. The resulting case survey method allows an analyst to aggregate the case study experiences and to assess the quality of each case study in a reliable and replicable manner.",https://www.jstor.org/stable/2391997,Administrative Science Quarterly,10.2307_2391997,Management & Organizational Behavior,1975.0,0,9.048172796610743e-05,1,0.9999692440032959,0,0.000228620003326796
49,,,,An Interactive Multiple Objective Linear Programming Method for a Class of Underlying Nonlinear Utility Functions,"This paper develops a method for interactive multiple objective linear programming assuming an unknown pseudo concave utility function satisfying certain general properties. The method is an extension of our earlier method published in this journal [18]. Various technical problems present in predecessor versions have been resolved. In addition to presenting the supporting theory and algorithm, we discuss certain options in implementation and summarize our practical experience with several versions of the method.",https://www.jstor.org/stable/2631353,Management Science,10.2307_2631353,Management & Organizational Behavior,1983.0,0,2.6420153517392464e-05,0,0.0003157841565553099,0,0.0001032514774124138
