stance twd. demog persp. (1: positive; 0.5: maybe; 0: none),notes,other persp.?,article_name,abstract,jstor_url,journal_title,edited_filename,primary_subject,publicationYear,cult_pred,cult_score,rel_pred,rel_score,dem_pred,dem_score
,,,Socioeconomic Achievement and the Machiavellian Personality,"To test the hypothesis that education moderates the relationship between interpersonal manipulativeness (""Machiavellianism"") and social atainment, data from a national sample (N = 1482) were reanalyzed. The resultss indicated that, for men with above-average educations, Machiavellianism is associated with higher levels of occupational prestige and larger incomes. However, for men with below-average educations, Machiavellianism is inversely related to occupational attainment, and unrelated to income attainment. Estimates of a structural equation model of the attainment process further support this interpretation, even after controls for race, age, social origins and education are applied. Extension of these analyses to status attainment among women revealed that Machiavellianism appears to have a facilitative effect upon women's attainment, but no evidence of an interaction effect was found. It is suggested that this pattern of results may reflect differences in the process of attainment in white-collar and blue-collar occupations.",https://www.jstor.org/stable/3033481,Sociometry,10.2307_3033481,Sociology,1977.0,0,0.001121114008128643,0,0.00014181631559040397,1,0.9973129630088806
,,,THE RELATIONSHIP BETWEEN INTERNALIZATION AND SELF-ESTEEM AMONG BLACK ADULTS,"We address whether individual variation in internalization of positive or negative racial stereotypes was associated with low levels of self-esteem in a national probability sample of 2,107 self-identified black adults interviewed face-to-face in 1980 (National Survey of Black Americans). Rejection of positive stereotypes and acceptance of negative stereotypes were statistically linked to declining levels of self-esteem, controlling for background variables such as gender, region, education, age, income, marital status, and skin color. Weak evidence was found to suggest that the relationship between negative stereotype acceptance and self-esteem depended upon how close respondents felt to other blacks. We advocate that closer attention be given to conceptualizing internalization and measuring its psychological impact among stigmatized groups exposed to social discrimination.",https://www.jstor.org/stable/20832150,Sociological Focus,10.2307_20832150,Sociology,2002.0,0,0.0002910052426159382,0,0.00014857982750982046,1,0.9981439113616943
,,,Changes in Women's Status in Women's Magazine Fiction: Differences by Social Class,"Women's magazines reflect and reinforce ideal characteristics of different social groups. Comparing the images of women in women's magazine fiction between 1970 and 1975 and between middle-class and working-class magazines, the former reflected economic and political movements in the relative status of women of that class. Middle-class women's fiction portrayed women as less likely to be valued for dependence and ineffectuality in 1975 as compared to 1970, and more likely to be valued for independence; plot devices were less likely to rely on traditional stereotypical female modes of behavior. In contrast, female passivity became more valued in working-class fiction. While in 1970, working-class women's fiction portrayed and valued the more active female characteristics, by 1975, that fiction had become significantly more traditional than middle-class fiction. This increase in valuing female passivity corresponds to the reversal of the long term secular trend from the 1950s onward of increased female labor force participation. Between 1970 and 1975 the labor force participation of women with less than high school education declined and job segregation by gender increased. Furthermore, the class selectivity in mobilization of symbols by the women's movement is evident.",https://www.jstor.org/stable/800041,Social Problems,10.2307_800041,Sociology,1979.0,0,0.010430369526147842,0,0.00016407479415647686,1,0.9023743271827698
,,,The ethnic geography of EthniCities: The 'American model' and residential concentration in London,"Does London conform to the classic American model — based on the work of the 'Chicago School' — with regard to the residential segregation of ethnic groups? To address this question, methods of analysing census small area data on ethnic group residential segregation in London are introduced, which provide more detailed information on the degree and extent of segregation than the usually employed methods of mapping and calculating single indices. These indicate very little spatial segregation of ethnic minority groups in London compared with New York, which is used here to exemplify the 'American model'. In both cities, however, the White majority is very substantially separated from other ethnic groups.",https://www.jstor.org/stable/23890526,Ethnicities,10.2307_23890526,Sociology,2002.0,0,2.7344509362592362e-05,1,0.9999306201934814,1,0.9829515814781189
,,,Using Sociological Theory to Defuse Anti-Arab/Muslim Nativism and Accelerate Social Integration,"For three days after the 9/11 attacks, hundres of angry suburbanites gathered to surround and lay siege to the bounded neighborhood hosting the Mosque Foundation in Bridgeview, Illinois. I concluded from a two and one-half year ethnographic study of the post-9/11 experience of Arab Muslims in metropolitan Chicago that the underlying sociological conditions giving rise to these post-9/11 events were racialized and nativist understandings held by a significant proportion of southwest suburban whites that positioned Arab and Muslim Americans as cultural threats to their communities. Armed with this knowledge, I designed a research project, outlined here, that included a social action component with the objective of expediting the social and civic integration of Arab and Muslim Americans in metropolitan Chicago.",https://www.jstor.org/stable/23548716,Journal of Applied Social Science,10.2307_23548716,Sociology,2007.0,0,0.3256414830684662,0,0.2691287398338318,1,0.9205809831619263
,,,Racial Disparities in Children with Behavior Problems in School: Causes and Solutions,"This article highlights the racial disparities in children with behavior problems at home and in school and suggest some causes and solutions to address this issue. Contributing causes for the behavior problems exhibited by children were gathered from two studies by the author which examined (1) exposure to maternal substance abuse and (2) changes in homes. Strategies to deal with challenging behaviors by parents, teachers and professionals should recognize the potential impact of substance exposure and changes in the family on the misbehaving child.",https://www.jstor.org/stable/43496964,"Race, Gender & Class",10.2307_43496964,Sociology,2014.0,0,1.0826342077052686e-05,1,0.9971031546592712,1,0.9462246298789978
,,,The Role of Father's Occupation on Intergenerational Educational and Occupational Mobility: The Case of Second-Generation Chinese Americans in New York,"A considerable body of research has found a positive relationship between parents' socioeconomic Status and children's educational achievement and attainment. The predictive role of parents' socioeconomic Status generally applies for most racial and ethnic groups, but that association does not always hold for groups that exhibit high levels of education, such as Asian Americans. This article considers the role of parents' education and occupation on children's educational and occupational attainment for Chinese Americans aged 18-32. The results corroborate the positive link between parents' socioeconomic Status and children's educational and occupational attainments. Children of Professionals command an educational and occupational advantage over children of entrepreneurs and children of manual workers. Yet, the children of entrepreneurs attend selective Colleges and obtain Professional occupations in proportions closely following those of the children of Professionals. Although the educational attainments between the fathers who worked as entrepreneurs and those fathers engaged in manual work were comparable, it was the children of entrepreneurs who surpassed the children of manual workers with respect to educational and occupational achievement and attainment. This suggests that immigrant entrepreneurship contributes in the upward educational and occupational mobility of the children of entrepreneurs.",https://www.jstor.org/stable/40210338,Sociological Forum,10.2307_40210338,Sociology,2009.0,0,1.774844895408023e-05,1,0.8281435370445251,1,0.9983764886856079
,,,U.S. PATRIOT ACT AND RACIAL PROFILING: ARE THERE CONSEQUENCES OF DISCRIMINATION?,"Since September 11, 2001 new anti-terrorism laws like the U.S. Patriot Act have been instituted for national security purposes. These new laws have made many Muslim Americas very vulnerable to racial profiling and discrimination. The data use for this analysis was the Pew Research Forum Muslim Americans: Middle Class and Mostly Mainstream 2007. Robert Agnew's General Strain theory was used to examine whether racial profiling and discrimination enacted by these laws generate support for terrorism. Results indicate that there is very little support for associating Muslim racial profiling to support for terrorism. However, African Americans are more likely to support terrorism when they experience racial profiling and discrimination.",https://www.jstor.org/stable/41289191,Michigan Sociological Review,10.2307_41289191,Sociology,2011.0,0,2.066196975647472e-05,1,0.99887615442276,1,0.997469425201416
,,,Changes in the Segregation of Whites from Blacks During the 1980s: Small Steps Toward a More Integrated Society,"Residential segregation between blacks and whites persists in urban America. However, evidence from the 1990 Census suggests that peak segregation levels were reached in the past. We evaluate segregation patterns in 1990 and trends in segregation between 1980 and 1990 for the 232 U.S. metropolitan areas with substantial black populations. We review the historical forces that intensified segregation for much of the twentieth century, and identify key developments after 1960 that challenged institutionalized segregation. The results suggest that the modest declines in segregation observed during the 1970s continued through the 1980s. While segregation decreased in most metropolitan areas, the magnitude of these changes was uneven. Testing hypotheses developed from an ecological model, we find that the lowest segregation levels in 1990 and the largest percentage decreases in segregation scores between 1980 and 1990 occurred in young, southern and western metropolitan areas with significant recent housing construction. Because the black population continues to migrate to such areas, residential segregation between blacks and whites should decline further, but remain well above that for Hispanics or Asians.",https://www.jstor.org/stable/2096131,American Sociological Review,10.2307_2096131,Sociology,1994.0,0,0.00034112471621483564,0,0.00020443732501007617,1,0.9994426369667053
,,,MARITAL STABILITY AND SOCIAL MOBILITY,"Studies of social mobility have produced ""dissociative"" and ""compensatory"" hypotheses about its effects on primary group relationships, and on the former hypothesis social mobility could be expected to be potentially disruptive of marriage, although in fact the relationship between mobility and marital stability has not been widely studied. Taking as starting point an article which denies the dissociative hypothesis in regard to marriage, this paper indicates that there are problems both of data and of definition in resolving this issue. The paper also suggests that there are reasons for supposing that social mobility can be disruptive of marriage, but that the matter cannot be settled by examining the overall statistical relationships of a few gross indicators. Rather than measuring net effects, enquiry should seek to discover patterns of effect and refined depiction of syndromes of marital instability.",https://www.jstor.org/stable/23028525,International Journal of Sociology of the Family,10.2307_23028525,Sociology,1978.0,0,0.00022596785856876522,0,0.00019645033171400428,1,0.9749587178230286
,,,TRADE UNIONISM AND THE INSURANCE CLERK,"This paper attempts to demonstrate that changes in the class situation of insurance workers were important amongst the factors explaining the rapid increase in the density of TUC affiliated unionism amongst insurance clerks from the late 1960' s onwards. The clerical class position is situated in terms of Marxist categories, and related to the Weberian categories of'work' and 'market' situation. There then follows a brief history of insurance unionism. I then chart the economic difficulties of the insurance industry from the late 'fifties onwards; these were followed by the widespread rationalization of the insurance labour force—in particular, the introduction of the computer. I argue that the application of 'modern managerial techniques' and computer technology has transformed the nature of the insurance labour force—and thus the 'work' and 'market' situation of the insurance clerk. In conclusion, I briefly review other factors—e.g. government policy—which, together with the changes in class situation, have contributed to the growth in trade union membership amongst insurance workers.",https://www.jstor.org/stable/42853377,Sociology,10.2307_42853377,Sociology,1979.0,0,0.003175213001668453,0,0.00016626264550723135,1,0.9524814486503601
,,,Nongenetic Familial Transmission of Psychiatric Disorders? Evidence from Children of Holocaust Survivors,"There is considerable evidence that psychiatric disorders aggregate in families, a phenomenon for which both genetic and nongenetic explanations have been proposed. However, since genetic and social inheritance usually co-occur, it is difficult to separate out their effects. In this paper, we argue that examining the rates of disorder among children of Holocaust survivors provides a special situation where genetic and nongenetic factors in familial transmission can be separated, and where specific nongenetic mechanisms can be tested. We specify competing hypotheses, and test their viability using data from an epidemiological study of psychiatric disorders conducted in Israel. We find no evidence of higher symptom scale scores or higher rates of current psychiatric disorders for the children of Holocaust survivors. However, they did have higher rates of past disorders.",https://www.jstor.org/stable/2137216,Journal of Health and Social Behavior,10.2307_2137216,Sociology,1994.0,0,0.0001611940679140389,0,0.0004451328713912517,1,0.9560714364051819
,,,Sexual Balkanization: Gender and Sexuality as the New Ethnicities,None,https://www.jstor.org/stable/40970998,Social Research,10.2307_40970998,Sociology,1993.0,1,0.8206385374069214,0,0.0001400790933985263,1,0.9875414967536926
,,,Black Workers Ambivalence toward Unions,None,https://www.jstor.org/stable/20006914,"International Journal of Politics, Culture, and Society",10.2307_20006914,Sociology,1989.0,0,0.20913007855415344,0,0.02718125842511654,1,0.9876101016998291
,,,Who Contacts Whom? Educational Homophily in Online Mate Selection,"Data from an online dating platform are used to study the importance of education for initiating and replying to online contacts. We analyse how these patterns are influenced by educational homophily and opportunity structures. Social exchange theory and mate search theory are used to explain online mate selection behaviour. Our results show that educational homophily is the dominant mechanism in online mate choice. Similarity in education significantly increases the rate of both sending and replying to initial contacts. After controlling for the opportunity structure on the platform, the preference for similar educated others is the most important factor, particularly among women. Our results also support the exchange theoretical idea that homophily increases with educational level. If dissimilarity contacting patterns are found, women are highly reluctant to contact partners with lower educational qualifications. Men, in contrast, do not have any problems to contact lower-qualified women. Studies of educational homogamy generally show that couples where women have a higher level of education are rare. Our study demonstrates that this is mainly the result of women's reluctance to contact lower qualified men.",external-fulltext-any,European Sociological Review,10.2307_41236583,Sociology,,0,4.7474259190494195e-05,1,0.9983137845993042,1,0.9388068318367004
,,,RESTRUCTURING INDUSTRY ON THE FACTORY FLOOR: NEO-FORDIST TENDENCIES AT WESTERN CAPE FIRMS,"This paper examines changes in manufacturing organisation and industrial relations at a number of Western Cape firms. It does so against the background of two debates: firstly, the international 'flexibility' or 'post-Fordism' debate and secondly, the domestic debate on a new industrial policy and the role that changes in the organisation of production – particularly those modelled on the flexibility thesis – could have within such a policy. The paper argues that while the latter is far from being conclusive and bound to continue for some time, actual restructuring of labour processes and industrial relations at local firms is going ahead – often under the banner of 'world class manufacturing'. On the whole though, these innovations amount to a shift in the direction of neo- rather than post-Fordism.",https://www.jstor.org/stable/44461353,South African Sociological Review,10.2307_44461353,Sociology,1992.0,0,0.1431005895137787,0,0.00041842099744826555,0,0.00030314241303130984
,,,Religious Attendance and Subjective Health,"Epidemiologists often correlate religious attendance with a variety of health outcomes and claim that religion represents a protective factor with respect to health. However, these analyses are typically zero-order (i.e., uncontrolled) and thus fail to address the possibility that partialling out the effects of potential explanatory variables might reduce such associations to insignificance. Using a three-generations sample of Mexican American Catholics, the authors regress subjective health onto religious attendance, alternatively controlling for four such variables: social support, physical capacity, social class, and subjective religiosity. Among both older and younger women, significant zero-order associations are explained away by removing the effects of physical capacity. These findings lend empirical support to theoretical work in social gerontology which suggests that religious attendance may represent a proxy for functional health, especially in older people.",https://www.jstor.org/stable/1386061,Journal for the Scientific Study of Religion,10.2307_1386061,Sociology,1986.0,0,2.024881359830033e-05,0,0.00011595980322454125,0,0.03120627999305725
,,,The Modern World as a Monolithic Iron Cage? Utilizing Max Weber to Define the Internal Dynamics of the American Political Culture Today,"If derived from the overall thrust of his sociological writings rather than his political essays, Weber's view of modernity is characterized by attention to the unique features of various advanced industrial societies rather than by a monolithic 'iron cage' vision. This study first demonstrates this point by briefly discussing central differences in the political cultures of Germany and the United States, and then by reconstructing, following Weber, the classic dualism in the American political culture: a 'world mastery' and self-reliant individualism stands opposed to–though also intertwined with–a public sphere penetrated by civic ideals. Although Weber's expectations regarding the fate of this classical dualism in the twentieth century can be seen today to be largely incorrect, the utilization of an axiom central to his comparative-historical sociology yields a powerful conceptualization of the present-day American political culture: pendulum movements across a 'tripolar constellation' are identified. This application of Weber's sociology reveals its analytic power even today.",https://www.jstor.org/stable/24579557,Max Weber Studies,10.2307_24579557,Sociology,2001.0,1,0.999935507774353,0,0.0006908139912411571,0,0.0006462546880356967
,,,Structural Change and New Cleavages: The Progress Parties in Denmark and Norway,"The Progress parties have been variously dubbed 'flash party', 'protest party', 'tax-revolt party', 'petty bourgeois protest movement', 'populist party', 'extreme right-wing party'. None of these labels passess unambiguously through a critical examination. More recently, commentators have sometimes referred to the Progress parties as 'conventional' bourgeois parties. Such a label is, however, also problematic, as the social background or class profile of both parties shows an increasing deviation from 'conventional' bourgeois parties. Our approach is that the Progress parties must be interpreted in connection with the new cleavages in postindustrial society. We discuss the Progress parties in relation to cleavages emanating from the welfare state, and in particular to postindustrial materialism and the changed role of the working class.",https://www.jstor.org/stable/4200798,Acta Sociologica,10.2307_4200798,Sociology,1990.0,0,0.0003057719150092453,0,0.00036003460991196334,0,0.055183298885822296
,,,Marketing Applied Sociology,None,https://www.jstor.org/stable/43481257,Journal of Applied Sociology,10.2307_43481257,Sociology,1985.0,1,0.9952574372291565,0,0.00029443789389915764,0,0.0018937612185254693
,,,ELABORATION OF RECIPROCAL VARIABLES ARTICULATING RELATIVE INVOLVEMENT AND THEIR RELATIONS TO DELINQUENCY AND CRIMINAL CAUSALITY,"The purpose of this paper is to elaborate the author's theoretical model of Relative Involvement, in which he has been involved during the past twenty years. The concept involvement, as conceptualized for this theoretical mode, implies closely related, reacting interactions among reciprocal variables in relations to delinquent and criminal causality. Symbolic interactions require a commitment process, which facilitates self-motivation. However, Weigert firmly believes there is more to selfmotivation than objective commitments. The feeling aspects of motivation require, also, relative degrees of involvement. Highly involved individuals ""flow"" into social interaction with a powerful flood of compelling feeling. Hence, motivation is concerned with a person's cognitive commitments to or against social situations. Whereas, feeling aspects of motivation constitute the person's relative degrees of involved meaning, which subject actor acquires for or against social interactions. Major emphasis is devoted to the self micro-interactional, and subcultural levels of analyses, as well as S her if s normative reference groups (not to be confused with Merton's ""comparison groups"").",https://www.jstor.org/stable/41421134,International Review of Modern Sociology,10.2307_41421134,Sociology,1997.0,0,1.597822665644344e-05,0,0.00022435134451370686,0,0.0012030848301947117
,,,Hierarchical Clique Structures,"The clique, as defined in graph theory, provides a rigorous abstraction of the idea of a ""tightly knit"" subset of a set of elements. A number of methods, known as ""clique detection procedures"", exist for finding the cliques of a given graph, but they are generally rather complex and unwieldy. When the graph is generalized to the network by permitting quantitative relationships, a hierarchical clique structure (i.e., an ordered sequence of clique groupings) can be derived. An literative method for finding hierachical clique structures is presented, which can also be used as a more conceptually straightforward clique detection procedure for graphs. The problem of finding a hierarchical clique structure in a network is formally related to clustering for proximity data, and the method presented also constitutes a types of hierarchical clustering procedure.",https://www.jstor.org/stable/2786466,Sociometry,10.2307_2786466,Sociology,1974.0,0,2.4993052647914737e-05,0,0.00028733801445923746,0,0.03223556652665138
,,,THE CHINESE IN THAILAND: AN ANNOTATED BIBLIOGRAPHY,"Students and researchers will find this annotated bibliography a valuable introduction to the existing literature on the Chinese in Thailand. The 20 theses, 13 articles, and 22 books presented are grouped according to the following areas of concern: General; Social Assimilation; Social; Economic; Political; and Law and Regulation. The bibliography shows that there are a number of scholarly works on the Thai-Chinese written in English.",https://www.jstor.org/stable/41853598,Philippine Sociological Review,10.2307_41853598,Sociology,1976.0,0,0.0008411405724473298,0,0.002228338969871402,0,0.27868032455444336
,,,LEISURE TIME ROLES OF WOMEN IN IRAN,None,https://www.jstor.org/stable/23028494,International Journal of Sociology of the Family,10.2307_23028494,Sociology,1991.0,0,1.56926762429066e-05,0,0.0022441649343818426,0,0.042449355125427246
,,,Popular Incorporation and Prospects for Democracy: Some Implications of the Brazilian Case,None,https://www.jstor.org/stable/657798,Theory and Society,10.2307_657798,Sociology,1990.0,1,0.5365836024284363,1,0.9952215552330017,0,0.0025200876407325268
,,,Consensual governance and myopic academia: A response to Liza Schuster and John Solomos,None,https://www.jstor.org/stable/23890307,Ethnicities,10.2307_23890307,Sociology,2004.0,0,0.0012255697511136532,0,0.00015442018047906458,0,0.021861379966139793
