stance twd. demog_fuzzy persp. (1: positive; 0.5: maybe; 0: none),notes,other persp.?,article_name,abstract,jstor_url,journal_title,edited_filename,primary_subject,publicationYear,cult_pred,cult_score,rel_pred,rel_score,dem_pred,dem_score
,,,CITYWARD MIGRATION AND URBAN FERTILITY IN THE PHILIPPINES,Studies of fertility differentials between native urbanites and rural migrants in developed countries usually show that the latter have higher fertility. That differentials of the same type are not necessarily found in a less developed country like the Philipines is demonstrated by a comparison of fertility levels of rural migrants originating in north-western Luzon and in Panay Island with those of native Manileños. A partial explanation of the relatively low fertility of Manila in-migrants is provided by the social-mobility theory which states that cityward migration is selective of persons with high-mobility aspirations and that migrants tend to participate in urban life — and consequently are exposed to its fertility-reducing tendencies — as least as much as native urbanites. Discrepancies between native-migrant fertility differentials found in the Philippines and in developed countries are reconciled by a theory of stages in the urbanization process. Hendershot's Manila data are from a 1966 survey; his rural data were gathered in 1967.,https://www.jstor.org/stable/23892517,Philippine Sociological Review,10.2307_23892517,Sociology,1971.0,0,2.982830483233556e-05,0,0.00016413723642472178,1,0.9489396214485168
,,,Relationships in Adolescence,"In this chapter I review recent research on the nature, meaning, and impact of extrafamilial relationships during adolescence. I use findings of quantitative and qualitative studies to develop the idea that close friendships, wider networks of peers, and romantic relationships have distinct meanings and significance for the developing adolescent. Sociologists' work inevitably focuses attention on the ways in which the adolescent's social addresses and locations (gender, race, social class) influence many aspects of these early relationships. The review also highlights some limitations of the dominant perspective on adolescent relationships, attachment theory, and provides suggestions for future research (particularly in the area of romantic relationships, where the literature is growing but still relatively undeveloped).",https://www.jstor.org/stable/30036968,Annual Review of Sociology,10.2307_30036968,Sociology,2003.0,0,4.084994725417346e-05,1,0.836952805519104,1,0.8610424399375916
,,,Mediation and Minority Members of Academe,"Focus groups are used to gather information from minorities in a university setting. Minority members of three campus groups (students, staff, and faculty) identified issues that could lead to relational conflicts. Alternative methods of dispute resolution are discussed in terms of their suitability and viability for use by minorities in academe. Mediation is presented as the preferred process for conflict resolution on an increasing number of college and university campuses. Mediation as a form of sociological practice in academia is a wide-open field of opportunity.",https://www.jstor.org/stable/43735727,Sociological Practice,10.2307_43735727,Sociology,2000.0,0,2.6742440240923315e-05,0,0.0007049210835248232,1,0.9345951080322266
,,,Rapid Changes in Household Composition among Low Income Mothers,"Change in family structure over a 17 month period in a sample of 123 low-income urban and rural Wisconsin mothers who gave birth in 1974 is examined. One-third of the households changed household types as measured by presence or absence of male partner and/or extended family members. One-third of the mothers were heads of households at the study's outset; of these, two-thirds remained heads over the time period. Mother's age, education, and poverty status were characteristics most strongly related to household composition changes. These results suggest that considerable fluidity occurs in family composition over relatively short time periods, and caution should be taken when relating characteristics of families at one point in time to an outcome measure, such as child development, which depends on the passage of time.",https://www.jstor.org/stable/584076,Family Relations,10.2307_584076,Sociology,1980.0,0,1.9731944121303968e-05,0,0.039169639348983765,1,0.9998916387557983
,,,WE ARE HUMANS AND NOT DOGS: THE CRISIS OF HOUSING DELIVERY IN POST-APARTHEID CAPE TOWN,None,https://www.jstor.org/stable/24583209,Berkeley Journal of Sociology,10.2307_24583209,Sociology,2014.0,0,0.003953968174755573,1,0.9999775886535645,1,0.9470977783203125
,,,"A Skeptical Note on ""Sophisticated"" Statistics: The Misuse of Loglinear Analysis to Measure Racial Bias",None,https://www.jstor.org/stable/20831388,Sociological Focus,10.2307_20831388,Sociology,1986.0,0,4.383788473205641e-05,0,0.00019244536815676838,1,0.8557202816009521
,,,Marxism and Social Movements: Theory and Practice for Social Justice,None,https://www.jstor.org/stable/2654138,Contemporary Sociology,10.2307_2654138,Sociology,1999.0,0,0.030868062749505043,0,0.02188711427152157,1,0.9760257005691528
,,,Segregation Shaped the San Mateo Housing Crisis,None,https://www.jstor.org/stable/43873239,"Race, Poverty & the Environment",10.2307_43873239,Sociology,2015.0,0,0.0014971400378271937,0,0.00019338181300554425,1,0.9990264177322388
,,,"Race, Sex, Class and Multicultural Education: Women's Angle of Vision",None,https://www.jstor.org/stable/41680218,"Race, Sex & Class",10.2307_41680218,Sociology,1994.0,0,2.6716999855125323e-05,0,0.000371840491425246,1,0.9949163198471069
,,,"Sociologists in Research, Applied, and Policy Settings: Bringing Professionals in from the Cold","Historically, U.S. sociologists employed outside the professoriate had lower status and were less likely to be considered professionals than those inside. Academic restructuring may result in a closing of the status gap. This article, based on the responses of 600 PhD sociologists employed in applied, research, and policy positions, focuses on whether historically agreed upon professional characteristics, such as use of specialized knowledge, autonomy, ethical norms, and basic research, are related to overall job satisfaction and satisfaction with economic security. We expected that professional characteristics were significantly related to overall satisfaction, but not to satisfaction with economic security. Our expectations were generally met. Respondents used sociological theories, methods, and concepts to analyze social issues, design interventions, and evaluate solutions. Professional job characteristics result in higher job satisfaction, when other factors are held constant. In contrast, professional characteristics do not significantly increase satisfaction with economic security; rather sector, occupation, and age cohort appear to do so.",https://www.jstor.org/stable/23548730,Journal of Applied Social Science,10.2307_23548730,Sociology,2007.0,0,0.001064806361682713,0,0.007014630828052759,1,0.8020340204238892
,,,Habitat Defense in Southeast Asian Cities,None,https://www.jstor.org/stable/24490868,Southeast Asian Journal of Social Science,10.2307_24490868,Sociology,1985.0,0,0.00020737746672239155,0,0.010416185483336449,1,0.8451919555664062
,,,Sociohistorical and Demographic Perspectives on U.S. Remarriage in 1910,None,external-fulltext-any,Social Science History,10.2307_1171555,Sociology,,0,4.412935231812298e-05,0,0.0004712999507319182,1,0.9748347401618958
,,,Educational Stratification and Social Change: Evidence from German Unification,"This research examines educational stratification over the course of German unification. During this transition, eastern German states experienced rapid educational restructuring and expansion of the upper secondary curriculum in the context of dramatic macro-level changes. The analysis, based on German Social Survey (ALLBUS) data, explores educational inequality at the secondary-school level with respect to social origins over the course of unification, comparing four settings: the pre-unification German Democratic Republic and Federal Republic of Germany, and eastern and western states of a now-united Germany. Empirical findings suggest widespread similarities in educational inequality between East and West Germany among cohorts schooled in the 1980s. Among those schooled in the 1990s, the two regions diverge somewhat more as the result of a moderate decline in the effects of social origins in eastern states.",https://www.jstor.org/stable/3559535,European Sociological Review,10.2307_3559535,Sociology,2003.0,0,1.3277931429911405e-05,0,0.0002088685578200966,1,0.9744805097579956
,,,Religious Service Attendance and Distress: The Moderating Role of Stressful Life Events and Race/Ethnicity,"Research findings on religiosity and mental health have been somewhat inconsistent over the years, leading researchers to examine different dimensions of religiosity to determine their individual and combined impacts on mental health. Aside from varying operationalizations of religiosity, stressful life events and race/ethnicity may be important moderators of the impact of religiosity on mental health. Secondary data analyses on a nationally representative sample of U.S. adults reveal a curvilinear relation of religious service attendance on distress. Specifically, those reporting moderate levels of service attendance also report lower levels of distress than their counterparts. Moreover, there were racial/ethnic differences with Hispanics and African Americans showing a stronger relationship between attendance and distress than non-Hispanic whites. However, there was no evidence that stressful life events interacted with attendance to explain distress.",https://www.jstor.org/stable/27652587,Sociology of Religion,10.2307_27652587,Sociology,2009.0,0,8.729262845008634e-06,0,0.0003205032553523779,1,0.9421877264976501
,,,Women and Urbanization,"The article generalizes on the basis of two field studies conducted in slum areas (Ratmalana near Colombo in Sri Lanka and Khlong Toey in Bangkok, Thailand) by Susanne Thorbek, who has her doctorate in Cultural Sociology. The article introduces some reflections on the most fundamental changes as a result of urbanization, the radical separation between factory and family, between the social units which are responsible for the production of things (and value) and of human life. This separation has grave consequences for women (and thus also for men) it is argued, and it becomes manifest and more extensive with urbanization. This separation is the structural basis for the sharpened gender-struggle which develops in the cities, some outcomes of which are seen in terms of the changed definitions of the genders and their relationships, as well as the worldwide tendency to feminization of poverty. The impact of gender-struggle on women's work for incomes is discussed, a struggle which seems to be considerable since most women are dependent on men's networks or their relationship to individual men for access to reasonably paid work in both the registered firms and in most of the informal sector, or they are dependent on their male relatives' networks. Even in that part of the informal sector where they extend household chores into the market place (food, drinks, loans, small shops, prostitution), women are still partly dependent on such networks although the form may differ somewhat between the two areas. The forms and functions of families are likewise areas for gender-struggle and it is not only argued that city-life poses the extended and especially the women-centered family as a need for women but also that the cultural ramifications of gender-struggle have an important impact on the realization of such needs. The mothers without husbands are also discussed in this context. Finally, a few clues are given concerning the differences between the slum cultures and women's integration in these slum cultures. It is argued that either women's problems, that is problems with the production of life, are taken up as important topics by the whole slum culture, or women's problems are seen as their's alone, which then means that women become the problem in the slum culture. The study from Khlong Toey in Bangkok is published in ""Voices from the City"" (Zed Books 1987) and the other is forthcoming.",https://www.jstor.org/stable/4200719,Acta Sociologica,10.2307_4200719,Sociology,1988.0,0,0.0001325096673099324,0,0.0004406337393447757,1,0.9891448616981506
,,,Class Analysis and the Heavy Weight of Convention,None,https://www.jstor.org/stable/4194935,Acta Sociologica,10.2307_4194935,Sociology,2002.0,1,0.9917868971824646,0,0.0003508720255922526,0,0.0013138758949935436
,,,Time-Use Studies: A Tool for Macro and Micro Economic and Social Analysis,None,https://www.jstor.org/stable/27522717,Social Indicators Research,10.2307_27522717,Sociology,1993.0,0,2.2549187633558176e-05,0,0.00025252572959288955,0,0.02173132263123989
,,,"Practices, Opportunity, and Protest Effectiveness: Illustrations from Four Animal Rights Campaigns","Despite its central role in the study of social movements, research on political and cultural opportunity is problematic. The vague definition and broad applicability of the concept of opportunity make it difficult to identify all the opportunities that exist in a given protest situation. Furthermore, most analyses take place at the broad levels of culture and the state, which can obscure additional localized factors that create opportunity for protest to occur and succeed. A practice-oriented approach to studying political and cultural opportunity addresses some of these problems. Using data from a study of the outcomes of four animal rights campaigns, I examine opportunity across the campaigns by focusing on the practices targeted for change and the reasons why people engage in them. Viewing opportunity in this way highlights both structural and cultural elements of opportunity structures in national as well as local contexts.",https://www.jstor.org/stable/3097251,Social Problems,10.2307_3097251,Sociology,1999.0,1,0.9915006160736084,0,0.0007404194911941886,0,0.00017896480858325958
,,,The Impact of Prestige Orientation on Shadow Education in South Korea,"Widespread use of ""shadow education,"" is a major policy issue in East Asia, especially South Korea, where officials view it as harmful to educational and fiscal equity. Although previous research emphasizes functional explanations, this study takes an institutional approach, exploring how students' desire for prestigious matriculation influences their parents' spending on shadow education. It is around that that ""prestige orientation"" (1) significantly predicts parent spending, especially among students of lower socioeconomic status, and (2) yields strong impact among students with the least likelihood of prestigious matriculation. Such findings indicate that Korean shadow education serves purposes that are as much symbolic as instrumental.",https://www.jstor.org/stable/23057041,Sociology of Education,10.2307_23057041,Sociology,2011.0,0,0.0001014546724036336,0,0.0001924464595504105,0,0.0017444478580728173
,,,Blurring the Difference: The Politics of Identity in Northern Ireland,"The dominant interpretation of the sources of the conflict in Northern Ireland stresses the different national allegiances of Protestants (unionists) and Catholics (nationalists). As developed by the British and Irish governments on the one hand and many scholars on the other, the interpretation maintains that the identification of Protestants with Britain and of Catholics with Ireland is the main cause fostering the deep divisions on Northern Ireland. Exponents of this perspective – which is being called here the 'dual identity' approach – go on to prescribe constitutions for Northern Ireland that would allow both communities to express their identities and traditions. It is argued in this essay that this interpretation of Northern Irish politics is insufficient in explaining why Protestants have rejected several internal solutions that were meant to secure the union between Britain and Northern Ireland, which is their stated demand. The paper then suggests an alternative hypothesis: that Protestants also identify themselves as loyalists, that loyalism as an identity presumes and reinforces its opposite of disloyalism, and thus that in affirming their traditions, Protestants also accentuate the conflict with Catholics. The source of the conflict is not, then, just separate and distinct national identities, but the interaction of communal identities that presume and deny each other.",https://www.jstor.org/stable/44461166,South African Sociological Review,10.2307_44461166,Sociology,1990.0,0,0.046814605593681335,1,0.9991356730461121,0,0.018214311450719833
,,,"The Provision of Public Goods under Islamic Law: Origins, Impact, and Limitations of the Waqf System","The Islamic waqf appears to have emerged as a credible commitment device to give property owners economic security in return for social services. Throughout the Middle East, it long served as a major instrument for delivering public goods in a decentralized manner. In principle, the manager of a waqf had to obey the stipulations of its founder to the letter. In practice, the founder's directives were often circumvented. An unintended consequence was an erosion of the waqf system's legitimacy. In any case, legally questionable adaptations proved no substitute for the legitimate options available to corporations. As it became increasingly clear that the waqf system lacked the flexibility necessary for efficient resource utilization, governments found it ever easier to confiscate their resources. In the 19th century, the founding of European-inspired municipalities marked a formal repudiation of the waqf system in favor of government-coordinated systems for delivering public goods.",https://www.jstor.org/stable/3185418,Law & Society Review,10.2307_3185418,Sociology,2001.0,0,0.15770237147808075,0,0.00042009836761280894,0,3.261661549913697e-05
,,,"Social Change, Premarital Nonfamily Experience, and Spouse Choice in an Arranged Marriage Society","This article examines the influences of nonfamily experiences on participation in the selection of a first spouse in an arranged marriage society. The authors developed a theoretical framework to explain how a broad array of nonfamily experiences may translate into greater participation in the choice of a spouse. Analyses show that premarital nonfamily experiences, in general, and media exposure and participation in youth clubs, in particular, have strong positive effects on individual participation in the choice of a spouse. These findings suggest new ways of thinking about the relationship between social change and the transition away from arranged marriage. Overall, changes in these nonfamily experiences can account for a substantial fraction of the historical increase of youth involvement in mate selection.",https://www.jstor.org/stable/10.1086/498468,American Journal of Sociology,10.1086_498468,Sociology,2006.0,0,9.236711775884032e-05,0,0.00014847403508611023,0,0.08834465593099594
,,,"Globalizing Participation: ""Exporting"" the Participatory Budgeting Model from Brazil to the Dominican Republic",The Participatory Budgeting (PB) model implemented in the Dominican Republic is an interesting test case to explore ways in which globalization has a potential to expand rather than reduce spaces for citizen participation at the local level. The paper explains the implementation of PB in the country based on diffusion channels facilitated by globalization. The article examines the nature of those channels as well as the two distinct PB models associated with them.,https://www.jstor.org/stable/41035622,Berkeley Journal of Sociology,10.2307_41035622,Sociology,2007.0,0,0.00013120059156790376,0,0.00025843727053143084,0,0.00013607485743705183
,,,"Open Source Software Production, Spontaneous Input, and Organizational Learning","This work shows that the modular organization of voluntary open source software (OSS) production, whereby programmers supply effort of their accord, capitalizes more on division than on specialization of labor. This is so because voluntary OSS production is characterized by an organizational learning process that dominates the individual one. Organizational learning reveals production choices that would otherwise remain unknown, thereby increasing productivity and indirectly reinforcing incentives to undertake collective problem solving.",external-fulltext-any,American Journal of Economics and Sociology,10.2307_41329169,Sociology,,0,3.5360935726203024e-05,0,0.00038683987804688513,0,0.017134947702288628
,,,"Dependence Power, Legitimacy, and Tactical Choice","This study examines the impact of dependence power and legitimate authority on evaluations of various tactics in a two-party conflict. In a role-play vignette study we asked 320 college students to take the position of a subordinate in a conflict with a manager, and to evaluate their own likelihood of adopting six options suggested by Bacharach and Lawler's analysis of dependence and tactial choice and by Zelditch and Walker's legitimacy approach to stability: threat to leave, coalition with other subordinates, appealing to a higher authority, appealing to a higher authority in a coalition, persuasion, and conflict avoidance. The factorial design manipulated subordinates' and superordinates' alternatives, as well as endorsement and authorization of the superordinate. Results generally support our predictions on the relationships between dependence and legitimacy dimensions on the one hand, and specific tactical evaluations on the other. They show that threat to leave is relted directly to self and other alternatives, while evaluations of coalition formation, appeal to a higher authority, and a combination of these two tactics are related directly to the legitimacy dimensions. Evaluations of conflict avoidance are related directly to both dependence and legitimacy: persuasion is viewed as a more likely option regardless of variation in the depedence and legitimacy dimensions.",https://www.jstor.org/stable/2787047,Social Psychology Quarterly,10.2307_2787047,Sociology,1996.0,0,0.1616583913564682,0,0.00012483465252444148,0,0.00019803119357675314
,,,UNEQUAL SOVIET CHILDHOODS AND POST-SOVIET HEALTH INEQUALITIES,"This paper analyzes contributions of the Soviet system to Post-Soviet health inequalities. Utilizing survey and interview data collected in St. Petersburg, Russia, 1992 - 2008, and focusing on the post-War generation, we analyze SES differences in early life experiences of Soviet citizens. Our results indicate the extent to which material and psychological foundations of health, health beliefs, illness experiences, and quality of medical care correlated with SES. Higher status individuals had far healthier childhoods and brought significantly more social, cultural, and health capital into the Post-Soviet transition. Under the new conditions health inequalities are greater but they follow similar patterns.",https://www.jstor.org/stable/41421386,International Review of Modern Sociology,10.2307_41421386,Sociology,2010.0,0,1.7539954569656402e-05,0,0.00035220765857957304,1,0.965048611164093
,,,Scale and Context: Approaches to the Study of Canadian Migration Patterns in the Nineteenth Century,None,https://www.jstor.org/stable/1171450,Social Science History,10.2307_1171450,Sociology,1988.0,0,0.0001453339064028114,0,0.00015573683776892722,1,0.9385727047920227
,,,RESPONSE BIAS IN CHILDREN'S REPORTS OF PARENTAL STATUS CHARACTERISTICS,"Children's awareness of parental status characteristics and their ability to accurately report these characteristics was investigated. On the whole, the validities of the children's reports of father's occupation, father's education, and mother's education were moderately high. Children with socially advantaged backgrounds were more likely to not only be more aware of status variables, but to more accurately report them as well.",https://www.jstor.org/stable/20830908,Sociological Focus,10.2307_20830908,Sociology,1974.0,0,1.6311196304741316e-05,0,0.0001886131940409541,1,0.9991766810417175
,,,The Incorporation of Women into Higher Education: Paradoxical Outcomes?,"Unlike the extensive cross-national research on occupational sex segregation, sex segregation within higher education has yet to be empirically examined comparatively. This article reports analyses for a wide range of countries from 1965 through 1990, using two measures of gender differentiation by field of study. The results indicate that gender differentiation has declined surprisingly little. Women are more likely to graduate from education, arts, humanities, social sciences, and law, and men are more likely to graduate from natural sciences, mathematics, and engineering. Few differences are found between more-and less economically developed countries. These findings echo those in the occupational sex segregation literature.",https://www.jstor.org/stable/2673196,Sociology of Education,10.2307_2673196,Sociology,2000.0,0,2.3354141376330517e-05,0,0.0002141636359738186,1,0.9986225366592407
