,,,The Seven Up! films: Connecting the personal and the sociological,"Michael Apted's documentary film series, which tracks 14 British children as they move from ages seven to 49, connects the personal with the sociological. Organized around the phenomenology of 'growing older together' (Schutz, 1976), the films invite emotional identification as they go about exploring unique, shared, and fluctuating experiences of the self. The documentaries resonate with the work of ethnographers who revisit the field, who seek to craft coherent narratives from a surplus of material, and who confront ethical problems as they investigate the private lives of subjects. The Seven Up! linear narrative of social class determination loosened in subsequent films as contingency, variation, and the dynamics of gender, generation, and parenting came more fully into view. The films embed tensions between linear and contingent, open-ended forms of temporality, juxtaposing varied forms of time: subjective (with fluctuating orientations of consciousness), physical aging, personal maturation, life course, biographical, historical, and generational.",https://www.jstor.org/stable/24048104,Ethnography,10.2307_24048104,Sociology,2009.0,0,0.0002425674902042374,0,0.0015498941065743566,0,0.16200724244117737
,,,"World System Position, Dependency, and Democracy: The Cross-National Evidence","Semiperipheral and peripheral positions in the world system are thought to reduce a country's chances for political democracy, but this hypothesis has been neglected in empirical research. Arguments from dependency and world system theory suggesting such a relationship are first derived. Next, a regression analysis of the relations of political democracy to world system positions and economic development is undertaken. Using partial regression plots, six countries that appear to be misclassified on the Snyder and Kick (1979) world system measure are identified. A reanalysis of the data with these cases reclassified demonstrates the negative influence of peripheral and semiperipheral positions on democracy for the full sample as well as random subsamples. Throughout the analysis economic development has a significant, positive effect on political democracy.",https://www.jstor.org/stable/2117715,American Sociological Review,10.2307_2117715,Sociology,1983.0,0,9.7149049906875e-06,0,0.0002357398916501552,0,0.0021051254589110613
,,,A Critical Examination of the Causal Structure of the Fishbein/Ajzen Attitude-Behavior Model,"Since the ""discovery"" of attitude-behavior inconsistency in the 1930s by LaPiere and others, the study of the relationship between attitudes and behavior has come a long way. During the 1960s and early 1970s researchers systematically examined the problem of attitude-behavior incosistency, showing that the attitude-behavior relationship depends on ""other"" variables. In the middle and late 1970s much of this research was integrated and synthesized in various general models of behavior, the most significant of which is the Fishbein/Ajzen model. This paper critically examines the causal structure of that model. Specifically, it examines the theoretical problems and issues generated by the parsimonious causal structure of the model, that is, the structure underlying the traditional attitude concept and the relationships between other varibles and the model concepts.",https://www.jstor.org/stable/3033889,Social Psychology Quarterly,10.2307_3033889,Sociology,1984.0,0,1.2805779988411814e-05,0,0.00020191929070279002,0,0.00038802617928013206
,,,Black Clergy in the 2000 Election,"Using survey data collected on African Methodist Episcopal and Church of God in Christ clergy, this article finds that black clergy are strongly supportive of their roles as community leaders. However, there are differences along denominational lines in terms of how they interpret their role, in their policy preferences, and in their activities both in and out of the pulpit. In total, this study reveals that there is diversity in black clergy attitudes and activities and that there is a need to examine further how these differences affect black political attitudes and activism.",https://www.jstor.org/stable/1387905,Journal for the Scientific Study of Religion,10.2307_1387905,Sociology,2003.0,0,0.0001818039163481444,0,0.000142407399835065,1,0.7604410648345947
,,,Organizational Dilemmas in Innovating Social Services: The Case of the Community Action Centers,"It is proposed that the precariousness of the Community Action Centers was due to unresolved organizational and administrative problems. The study of four Community Action Centers indicated that their effectiveness was hampered by major organizational problems including an inability to develop stable bases of support in the community, failure to establish crucial and systematic service linkages with other social service agencies, lack of an information system to guide their service functions, and difficulties in developing effective client-staff relations.",https://www.jstor.org/stable/2948556,Journal of Health and Social Behavior,10.2307_2948556,Sociology,1971.0,0,6.443722668336704e-05,0,0.00023031780438032,0,0.002289565047249198
,,,The New Conservatism: Political Ideology and Class Structure in America,None,https://www.jstor.org/stable/40972332,Social Research,10.2307_40972332,Sociology,1982.0,1,0.878447413444519,0,0.0001695526298135519,0,0.001584558398462832
,,,"The Role of Agro-Commercial Capital in ""Rural Development"" in South India",None,https://www.jstor.org/stable/3516801,Social Scientist,10.2307_3516801,Sociology,1979.0,0,0.0007405723445117474,1,0.8537020683288574,0,0.00017989073239732534
,,,Aids and Gay Men: Individual Strategies and Collective Coping: A Follow-Up Study of Gay Men in the Federal Republic of Germany,"This paper summarizes the results of two surveys assessing the changes in the sexual behaviour of homosexual men under the impact of AIDS in West Germany and West Berlin. The risk of possible infection is increasingly taken into account by gay men in the Federal Republic. Regular use of condoms has already gained widespread acceptance-considering the short time available to become familiar with such usage. Attitudes to the risk of infection are chiefly determined by the impact of AIDS in the immediate social environment, by the extent of social integration in a network of supportive groups and by the degree to which the homosexuality of gay men is accepted by their social environment. In spite of the high level of information about AIDS that most gay men have at their disposal, and the widespread adoption of low-risk sexual practices, it remains apparent that certain subgroups are still not being adequately reached. 'Closeted' homosexuals, homosexuals with low educational and professional status and bisexual men are substantially less well informed than self-identifying gay men with higher educational and professioanl status. Concepts that better appeal to and better inform these groups are urgently required. The demographic group 'males with homosexual behaviour' can only be reached to a limited degree by targeting it as a homogeneous group.",https://www.jstor.org/stable/522490,European Sociological Review,10.2307_522490,Sociology,1990.0,0,4.28286730311811e-05,0,0.0003436855913605541,1,0.6744168996810913
,,,"Determinants of Morbidity and Disability Trends in the United States, 1958-77","Macrodynamic structural-equation models are presented that show how changes in annual levels of aggregate indexes of several morbidity and disability conditions for the United States over the years 1958 to 1977 affect each other and are affected by other aggregate demographic and socioeconomic changes. After reviewing the record of annual changes in these indexes based on data from the National Health Interview Survey, patterns of temporal covariation in the time series are discussed and some tentative structural-equation models are constructed to account for their behavior. Statistically, the analyses reveal considerable variation in levels of year-to-year variance explained for these indexes - from 35 percent explained for days of school loss to 97 percent for all acute conditions. Substantive findings imply that a decreasing proportion of preschool children in the population contributes to a decline in the incidence of infective and parasitic diseases, and an increasing proportion of the population at the older ages results in increases in the prevalence of chronic conditions, days of bed disability, and days of restricted activity. Further, increases in economic prosperity lead to an increase in the incidence of injuries and a decrease in the incidence of viral conditions, while higher levels of unemployment produce more injuries and restricted activity days. These inferences corroborate, for the most part, results of prior studies that have been restricted to cross-sectional analyses. In addition, however, they provide a basis for making explicit quantitative projections of future levels of morbidity and disability in the American population on the basis of exogenous demographic and socioeconomic conditions.",https://www.jstor.org/stable/27520979,Social Indicators Research,10.2307_27520979,Sociology,1981.0,0,1.6410771422670223e-05,0,0.00018165246001444757,1,0.9811958074569702
,,,The Stranger Transformed: Conceptualzing On and Offline Stranger Disclousure,"Disclosures, secrets, and stranger associations have long intrigued social researchers. In this article I consider the transformation of stranger associations with the use of mediated communication. I consider how non-mediated and mediated forms of stranger associations vary based on characteristics such as synchronicity, distance, ease of break, permanency of break, and stranger shopping. In addition, I propose the concept of ""strange making technologies""—those that create for acquaintances and intimates that particular tension between remoteness and distance that Simmel identified as unique to the form of the stranger. Furthermore, I suggest that this strange making quality that is particularly strong in Internet communications has both the potential to deepen and dismantle already established relationships.",https://www.jstor.org/stable/23250083,Social Thought & Research,10.2307_23250083,Sociology,2001.0,0,0.0003521425533108413,0,0.0002892838674597442,0,0.0028445743955671787
,,,"The English village, whiteness, coloniality and social class","This article explores the entwining of discourses of race, class and coloniality within a specific set of racialised discourses articulated by white middle-class and middle-aged residents of a suburban English village. I draw upon Fran ken berg's (1993) analysis of whiteness and the contemporary reproduction of colonial notions of cultural difference to examine whites' othering of wealthy British Asian (BrAsian) residents and the everyday construction of non-Western others. My contention is that central to the reproduction of the idea of the village as a white and English space is amnesia of the colonial past and its implications for the postcolonial present. I examine how this process of amnesia mediates an aspect of my co-conversationalists' representations of wealthy BrAsian residents as immigrants, that is, cultural others whose origins are thought to belong outside the village community, the nation and ultimately the West.",https://www.jstor.org/stable/43572634,Ethnicities,10.2307_43572634,Sociology,2012.0,0,0.062327466905117035,1,0.9903951287269592,1,0.9288977384567261
,,,"Defining Appropriate Labor: Race, Gender, and Idealization of Black Women in Domestic Service","Appropriate labor conveys the notion of a negotiated ideal indicating who has been collectively defined as suited for a particular type of work. Importantly, these negotiations provide a justification for why a group is represented in one occupation as opposed to another. Using domestic service as an example of an occupation based in an informal, female-centered organizational structure we illustrate the process by which black women came to be seen as the idealized worker in Northern U.S. households between the mid-19th and -20th centuries. The analyses demonstrate that the designation of black women as appropriate labor enabled the maintenance of an institution that was vital to the social reproduction functions of white, middle-class, American households.",https://www.jstor.org/stable/43497500,"Race, Gender & Class",10.2307_43497500,Sociology,2012.0,1,0.9999680519104004,0,0.0003719301603268832,1,0.9990447163581848
