,,,The Communication of Innovations: the influence of the foreign trained returnee on socio-cultural change in developing countries,None,https://www.jstor.org/stable/43895757,Southeast Asian Journal of Sociology,10.2307_43895757,Sociology,1971.0,0,0.41292834281921387,0,0.0010594103951007128,0,0.00794152356684208
,,,The 1990 Mohawk-Oka Conflict: The Importance of Culture In Social Movement Mobilization,None,https://www.jstor.org/stable/41675337,"Race, Gender & Class",10.2307_41675337,Sociology,1996.0,1,0.8272538781166077,0,0.0016997942002490163,0,0.002879648469388485
,,,RURAL SOCIOLOGY IN BRAZIL-INSTITUTIONAL GROWTH (1965-1977),"Rural sociology has been institutionalized in Brazil during the past 15 years. In this paper, data from a recent survey sponsored by the Brazilian Ministry of Education are used to review the five existing graduate programs. Specific attention is given to their origin, present and projected staffing, students, curricula, and past and on-going faculty and student research. Analyses are cast within the context of the actual role of rural sociology in Brazilian national development policy and programs. The paper also highlights several points of potential collaborative interest between Brazilian rural sociologists and those of other nations. Included under this rubric are personnel interchange and collaborative research.",https://www.jstor.org/stable/41420677,International Review of Modern Sociology,10.2307_41420677,Sociology,1979.0,1,0.9997531771659851,1,0.9753084182739258,0,0.00687760952860117
,,,"Why Does Unemployment Come in Couples? An Analysis of (Un)Employment and (Non)Employment Homogamy Tables for Canada, the Netherlands and the United States in the 1980s","In this paper we first raise the factual question of whether wives of unemployed husbands have a higher chance of unemployment than wives of employed husbands. Data for Australia, Canada, the Netherlands and the USA in the first half of the 1980s indicate that this indeed is the case. We then seek to explain this finding. According to one explanation, (un)employment homogamy is a by-product of educational homogamy combined with a relation at the individual level between education and unemployment. Although the existence of educational homogamy in Canada, the Netherlands and the USA could be ascertained, and although in these countries unemployment is higher when education is lower, these findings could not fully explain the observed extent of (un)employment homogamy in these countries. According to a more complex explanation, the phenomenon of (un)employment homogamy will disappear when we allow, after these effects of education, for similar effects of age and region. This explanation was tested for the USA, and did not explain the observed extent of (un)employment homogamy in this country either. These findings show that labour market inequalities (unemployed persons have less education, are very young or very old, live in certain places) are aggravated by marriage market outcomes (educational and age homogamy). But, in addition, the finding of persistent couple effects suggests that, apart from labour market and marriage market effects, other processes taking place after marriage make for (un)employment homogamy.",https://www.jstor.org/stable/522542,European Sociological Review,10.2307_522542,Sociology,1988.0,0,7.976758206496015e-05,1,0.9974911212921143,1,0.9990604519844055
,,,Internet-Mediated Experiences of Underdevelopment: A Four-Country Survey of Academia,"Professional academics in Indonesia, Malaysia, Singapore and the United States have significantly different subjective experiences of Internet use. This difference appears not only in substantial inequalities of access, but also in a higher level of expectation and value placed on the Internet among Indonesians and secondarily Malaysians. These results, from a survey and interviews of teachers and researchers in the social sciences and humanities, are analyzed in the context of dependency theory within knowledge economies. While inadequate and unequal access to information and communication technology is a substantial problem, the article argues that emphasizing access, resource and skills development alone will not solve academic and other more general dependencies within knowledge economies. Rather, a simultaneous — if sometimes conflicting — emphasis on both infrastructural development and de-centered production of knowledge is called for.",https://www.jstor.org/stable/23654648,Asian Journal of Social Science,10.2307_23654648,Sociology,2007.0,0,1.1299427569610998e-05,0,0.00016434113786090165,0,0.003778454614803195
,,,"Firearms, Homicides, and Gun Control Effectiveness",None,https://www.jstor.org/stable/3052950,Law & Society Review,10.2307_3052950,Sociology,1972.0,0,1.6465748558402993e-05,1,0.9555297493934631,0,0.03395913541316986
,,,The Power of Silence? Opinion Contagion and the Surprise of the Polish 2005 Parliamentary and Presidential Elections,"This paper investigates opinion contagion in collective behaviour using threshold model (Granovetter (1978)). The theoretical background is the spiral of silence concept developed by Noelle-Neumann (1974), arguing that people only assert their opinions if they perceive a minimal support from a relevant proportion of others. We apply the model to explain the dispersion between pre-elections preferences and the final results of the Polish parliamentary and presidential elections in 2005. It is shown that the minority opinions were more widely-held than was declared in opinion polls as a consequence of different distributions of the threshold values of opinion assertion.",https://www.jstor.org/stable/41275093,Polish Sociological Review,10.2307_41275093,Sociology,2009.0,0,0.0011020865058526397,0,0.00015889130008872598,0,0.0035026129335165024
,,,Organizations and Fraud in the Savings and Loan Industry,"This article analyzes the organizational correlates of fraud in the savings and loan industry. We test the hypothesis that during the 1980s institutions that departed from the traditional activities of thrifts to embark on high-growth, high-risk strategies were more likely to be vehicles for fraud than were institutions that retained a more traditional focus. The results of an analysis of data from a sample of 686 insolvent savings and loan institutions support the hypothesis; stock-owned thrifts, those with a relatively low proportion of home mortgage loans, those with a high proportion of their assets in direct investments, and those that experienced high asset growth were the vehicles for the most costly and frequent incidents of suspected crime. These findings are related to theoretical issues regarding the role of organizations in white-collar crime.",https://www.jstor.org/stable/2580454,Social Forces,10.2307_2580454,Sociology,1995.0,0,0.00010234629735350609,1,0.8447462916374207,0,0.1232353001832962
,,,The CB Handle: An Announcement Of Adult Identity,"The CB handle is used as a means of exploring voluntary identity-making among adult CBers. While only an exploratory study, gender appeared to be the most deeply embedded adult identification. Other, apparently less deeply embedded, identities were found in occupation (white- versus blue-collar workers and truckers versus non-truckers). Sexual identifications seemed to have increased in importance with time, with ethnic identifications decreasing in importance. Finally, Turner's (1976) distinction between impulse and institutional anchoring of the real self was used to suggest that white-collar workers and new CBers had significantly more impulse-based handles than blue-collar workers and “old-timer” CBers.",https://www.jstor.org/stable/10.1525/si.1980.3.2.95,Symbolic Interaction,10.1525_si.1980.3.2.95,Sociology,1980.0,0,0.004148504696786404,0,0.0017885861452668905,1,0.9762312769889832
,,,Living Arrangements during Childrearing Years and Later Health of African American Mothers,"Using longitudinal data from the Woodlawn Project (N = 680), this study examined how patterns of living arrangements among a community cohort of African American mothers were associated with later physical and emotional health. We identified eight patterns of stability and transition in living arrangements during the childrearing years. Health outcomes include SF-36 Physical Functioning, SF-36 Bodily Pain, depressed mood, and anxious mood. Specific patterns of living arrangements were related to later health, controlling for age, earlier health, education, and poverty. Poverty explained many, but not all, of the relationships between living arrangements and health. Findings underscored the benefits of social support and social integration and highlighted the negative effects of marital dissolution on health.",https://www.jstor.org/stable/27752505,Journal of Marriage and Family,10.2307_27752505,Sociology,2009.0,0,7.180096417869208e-06,0,0.00018669833661988378,1,0.9604170322418213
,,,Coordinating Futures: Toward a Theory of Anticipation,"This article presents a theoretical approach for studying the coordination of futures. Building off theories of temporality and action, the authors map three different modes of future making—protentions, trajectories, and temporal landscapes—that actors need to coordinate in order to make sense of action together. Using a wide range of empirical evidence, they then show that these modes of future-coordination are autonomous from each other, so that although they are connected, they can clash or move in disjointed directions in interaction. By focusing on the coordination and disjunctures of those three modes, the authors argue that sociologists can provide a methodological axis of comparison between cases; depict mechanisms through which other theoretical or empirical constructs—such as racism or late modernity—operate; and open a window into the ways in which people organize and coordinate their futures, a topic of inquiry in its own right.",https://www.jstor.org/stable/10.1086/668646,American Journal of Sociology,10.1086_668646,Sociology,2013.0,0,0.000972145120613277,0,0.00015976515715010464,0,0.02471368946135044
,,,Alternative Approaches to Unobserved Heterogeneity in the Analysis of Repeatable Events,None,https://www.jstor.org/stable/270924,Sociological Methodology,10.2307_270924,Sociology,1986.0,0,4.310072836233303e-05,0,0.00027777263312600553,1,0.9713347554206848
,,,Social Cleavage and the Revival of Far Right Parties: The Case of France's National Front,"Does the left-right cleavage still structure citizen political behavior? What are the explanatory limits of cleavage politics? These questions are examined in light of support for a contemporary far right party, France's National Front. Though the predominance of former moderate right voters testifies to the cleavage's enduring influence, the weight of former left voters (especially those from the non-Communist left) indicates the importance of citizen concern with crosscutting political issues. Beyond voter movement from left and moderate right parties alike, however, explanation of far right success must also attend to the contribution of previous non-voters as well as the emergence of a new partisan loyalty.",https://www.jstor.org/stable/4201003,Acta Sociologica,10.2307_4201003,Sociology,1997.0,0,4.15526119468268e-05,0,0.004315570462495089,0,0.045001070946455
,,,Holistic Physicians: Implications for the Study of the Medical Profession,"This study compares members of the American Holistic Medical Association (N = 340) and a group of California family practice physicians (N = 142). The groups are similar in demographic characteristics. The holistic doctors are distinct in their training, practice characteristics, attitudes, clinical behaviors, motivations, and feelings of marginality. Personal experiences with religion/spirituality, psychotherapy, and maintaining a personal health regimen appear to be important distinguishing factors. These experiences are related to each other and to a holistic practice style among both types of physicians. The overall findings indicate a dimension of diversity among physicians which has been neglected until now.",https://www.jstor.org/stable/2137125,Journal of Health and Social Behavior,10.2307_2137125,Sociology,1987.0,0,0.2640744745731354,0,0.003629871876910329,1,0.9789922833442688
,,,Indicators of Climate Change in Idaho:,"Climate change is well documented at the global scale, but local and regional changes are not as well understood. Finer, local- to regional-scale information is needed for creating specific, place-based planning and adaption efforts. Here the development of an indicator-focused climate change assessment in Idaho is described. This interdisciplinary framework couples end users’ data needs with observed, biophysical changes at local to regional scales. An online statewide survey of natural resource professionals was conducted to assess the perceived impacts from climate change and determine the biophysical data needed to measure those impacts. Changes to water resources and wildfire risk were the highest areas of concern among resource professionals. Guided by the survey results, 15 biophysical indicator datasets were summarized that included direct climate metrics (e.g., air temperature) and indicators only partially influenced by climate (e.g.,wildfire).Quantitative changes in indicators were determined using time series analysis from 1975 to 2010. Indicators displayed trends of varying likelihood over the analysis period, including increasing growing-season length, increasing annual temperature, increasing forest area burned, changing mountain bluebird and lilac phenology, increasing precipitation intensity, earlier center of timing of streamflow, and decreased 1 April snowpack; changes in volumetric streamflow, salmon migration dates, and stream temperature displayed the least likelihood. A final conceptual framework derived from the social and biophysical data provides an interdisciplinary case example useful for consideration by others when choosing indicators at local to regional scales for climate change assessments.",https://www.jstor.org/stable/24907455,"Weather, Climate, and Society",10.2307_24907455,Sociology,2015.0,0,4.592685218085535e-05,0,0.0001560403616167605,0,0.14459502696990967
,,,The Limits of Logic in Sociology,None,https://www.jstor.org/stable/20006971,"International Journal of Politics, Culture, and Society",10.2307_20006971,Sociology,1990.0,0,0.35647886991500854,0,0.0005131484940648079,0,0.00034506991505622864
,,,Soviet Emigré Artists Life and Work in the USSR and the United States,None,https://www.jstor.org/stable/40784040,International Journal of Sociology,10.2307_40784040,Sociology,1985.0,0,0.006446800660341978,0,0.48780980706214905,0,0.005835230927914381
,,,"Civil Society and State Structures in Creative Tension: Ferguson, Hegel, Gramsci",None,https://www.jstor.org/stable/20006791,"State, Culture, and Society",10.2307_20006791,Sociology,1984.0,0,0.3200739324092865,0,0.0001535720657557249,0,0.0001261917204828933
,,,The Methodology of Grounded Theory in the Research of the Situation of Work,None,https://www.jstor.org/stable/44816334,The Polish Sociological Bulletin,10.2307_44816334,Sociology,1989.0,1,0.7520103454589844,0,0.0003207829431630671,0,0.00019628819427452981
,,,Sociology and the Multicultural Curriculum: The Challenges of the 1990's and Beyond,None,https://www.jstor.org/stable/41680037,"Race, Sex & Class",10.2307_41680037,Sociology,1993.0,0,0.00010783000470837578,0,0.0004588295705616474,1,0.9781856536865234
,,,Why Teach Applied Sociology? Four Reasons to Consider,"Why teach applied sociology? This paper attempts to answer this question by focusing on a variety of advantages and benefits that an applied approach provides to those who teach in traditional classroom academic settings. The paper begins by drawing on a parable about teaching a teenager to drive and suggesting that learning to drive and learning sociology might have a lot more in common than we might imagine. The issue is placed in the context of current trends in sociology, especially ""the scholarship of teaching and learning"" and ""public sociology."" Four reasons for teaching applied sociology are presented: 1) It promotes more effective teaching and learning. 2) It is grounded in the roots of American sociology. 3) It helps produce change-based research; and 4) Students desire a sociology they can use to engage the world and to help improve it. The paper concludes by arguing that teaching applied sociology provides students better preparation for a rapidly changing global economy.",https://www.jstor.org/stable/23548929,Journal of Applied Social Science,10.2307_23548929,Sociology,2010.0,0,0.00029672219534404576,0,0.005632962100207806,0,9.226905240211636e-05
,,,Social and Political Transformation in the Czech Republic,"The most apparent recent social change in the Czech Republic is the emergence of a new class structure. A large percentage of the population began their private activities in small business, while a part of them managed to become middle-scale entrepreneurs. During the privatisation of the large companies, realised mostly by the voucher method, different groups competed to achieve positions in the top economic elite. Analyses of social mobility and of the factors of the income distribution have shown that the following groups have a higher chance of being successful in the ongoing social de-equalisation: the younger generations, better-educated people, managers and private entrepreneurs and those former Communists who left the party after the political changes in 1989. These social processes are being accompanied by a gradual change in the political elite. In this field, the most successful are the younger middle-aged, new political activists pushing through the radical liberal economic reform. In spite of the clearly right-wing character of the ruling coalition, a democratically acquired social consensus exists for the time being, although some signs of social and political polarisation are visible. In the near future, two main alternatives of development are possible: a) the continuation of the liberal democratic reforms (whether it be a conservative, centrist or left democratic variant or a compromise combination of them is of less importance) and b) a populist and authoritarian interruption of the transformation processes (be it a radical leftist or rightist variant). The realisation of the first alternative is not only desirable from the point of view of joining the European Union in the foreseeable future, but also more likely given both the objective and subjective conditions within the Czech Republic.",https://www.jstor.org/stable/41133106,Czech Sociological Review,10.2307_41133106,Sociology,1994.0,0,1.8159997125621885e-05,0,0.00018132211698684841,1,0.9734237790107727
,,,Expanding the Marxian Notion of the Post-Colonial State,None,https://www.jstor.org/stable/3517804,Social Scientist,10.2307_3517804,Sociology,1991.0,0,0.4465501308441162,0,0.0003772106720134616,0,0.0014924387214705348
,,,Harnessing Intellectuals: Tensions between Democracy and Leadership in the Independent Trade Unions in the 1970s,"The article examines how the participation of white intellectuals in independent trade unions in South Africa influenced the democratisation process of the unions in the 1970s. It also presents contributions of seven theorists, namely Lenin, Perry Anderson, Michels, Perlman, Gramsci, Hobsbawm ana C Wright Mills, on the role of left-wing intellectuals in the labour movement. It finds that the white intellectuals were both committed to and facilitated the democratisation of the unions, but that their contradictory class location, the cultural cleavage between them and African workers, and ultimately the political context, impeded the process of democratisation. The theories of Gramsci and Hobsbawm turned out to be the most useful ones in helping to analyse the role of the intellectuals in the unions in the 1970s.",https://www.jstor.org/stable/44461133,South African Sociological Review,10.2307_44461133,Sociology,1989.0,1,0.9999196529388428,1,0.9972808361053467,0,0.2077302634716034
,,,"The Social Reproduction of a Criminal Class in Working-Class London, Circa 1950-1980","The historical concept of a criminal class includes a sociological reference to the concentration and recurrence of crime within groups and across generations. Two family-linked processes may lead to the social reproduction of a criminal class: a cultural/characterological process involving child-raising conditions and practices, and a structural/imputational process involving official labeling. Mead's concern about the perpetuation of a ""permanent class of criminals"" is discussed, and special attention is given to an intergenerational interaction effect of parent and son labeling on subsequent delinquent and criminal behavior. This intergenerational interaction effect is explored, net of the acknowledged role of cultural/characterological influences, which are modeled in several ways using data collected in a well-known London panel study. The article addresses implications of the neglect of labeling effects in contemporary longitudinal research initiatives directed to the formation of crime policy.",https://www.jstor.org/stable/2781103,American Journal of Sociology,10.2307_2781103,Sociology,1990.0,0,0.40531373023986816,0,0.00037022665492258966,1,0.9994182586669922
,,,A Theoretical Perspective on Cohort Marriage and Divorce in Twentieth Century Sweden,"A theoretical perspective is proposed in which changes in female labor-force participation are seen as being of central importance to analyses of changes in marital formation and dissolution. Opportunities for increased female labor-force participation are likely to improve the feasibility of marriage, i.e., the ability of a newly married couple to meet social and economic expectations, while possibly reducing the desirability of marriage relative to the available alternatives. At the same time, the greater participation of women in economic life seems to increase both the feasibility and desirability of divorce. The experience of cohorts of Swedish females born between 1885-1889 and 1940-1944 is examined, and found to be consistent with the theoretical arguments advanced.",https://www.jstor.org/stable/351707,Journal of Marriage and Family,10.2307_351707,Sociology,1979.0,0,1.0746764928626362e-05,0,0.0004680114216171205,1,0.9948840737342834
,,,Gender Gaps and the Presence and Profitability of College Football,"Objective. Data from the 1995-96 academic year for schools that compete at the Division I level of college athletics are analyzed to show how the presence and profitability of football influence female athletes in terms of both absolute and relative funding per athlete, as well as participatory opportunities in general. Methods. Two-stage least-squares estimation of a simultaneous system of equations, descriptive statistics, and paired i-tests are the methods used for analyzing the data. Results. Female athletes receive greater expenditures in absolute terms, but less in relative terms, the more prominent a school's football program. It is harder for schools with football to comply with the proportionality test. Southern schools and African American schools are more likely to be found in violation of Title IX rules compared to all other schools. Conclusions. The presence and profitability of football, as well as regional and ethnicity considerations, influence differences in spending per female athlete across Division I schools.",https://www.jstor.org/stable/42864401,Social Science Quarterly,10.2307_42864401,Sociology,1999.0,0,1.0359005500504281e-05,0,0.04134703055024147,1,0.9956016540527344
,,,Residential Mobility of Blacks and Whites: A National Longitudinal Survey,"A limited literature suggests that blacks move more often than whites but that their mobility is more local. In testing this double hypothesis with interviews from a national panel of 1,500 households, we find that greater black mobility is largely explained by blacks' tendency to be renters. Black renters are less likely to move, and black owners are about as stable residentially. Furthermore, blacks are more likely to move only within their nighborhoods or communities and much less likely to move elsewhere in the metropolitan area or to migrate out of it. Not only do different racial categories move differently, but they apparently do so for different reason.",https://www.jstor.org/stable/2776179,American Journal of Sociology,10.2307_2776179,Sociology,1971.0,0,1.0023773938883096e-05,0,0.0002407633583061397,1,0.9995403289794922
,,,Living Arrangements during Childrearing Years and Later Health of African American Mothers,"Using longitudinal data from the Woodlawn Project (N = 680), this study examined how patterns of living arrangements among a community cohort of African American mothers were associated with later physical and emotional health. We identified eight patterns of stability and transition in living arrangements during the childrearing years. Health outcomes include SF-36 Physical Functioning, SF-36 Bodily Pain, depressed mood, and anxious mood. Specific patterns of living arrangements were related to later health, controlling for age, earlier health, education, and poverty. Poverty explained many, but not all, of the relationships between living arrangements and health. Findings underscored the benefits of social support and social integration and highlighted the negative effects of marital dissolution on health.",https://www.jstor.org/stable/27752505,Journal of Marriage and Family,10.2307_27752505,Sociology,2009.0,0,7.180096417869208e-06,0,0.00018669833661988378,1,0.9604170322418213
