,,,Interracial Perceptions Among High School Students,"This paper presents data concernings: a) dimensions underlying interracial perceptions; b) ways in which students see other-race schoolmates with respect to these perceptual dimensions; and c) the accuracy of the interracial perceptions. Data were obtained from almost 2,000 black students and over 2,000 white students in eleven high schools of Indianapolis. Whites tended to see blacks in terms of a general negative and a general positive dimension but blacks distinguished more between different positive and negative aspects of whites. Those perceived differences between the races which were based on observable traits appeared to be somewhat accurate, but those based on judgments of motives were not.",https://www.jstor.org/stable/3033499,Sociometry,10.2307_3033499,Sociology,1976.0,0,2.447868428134825e-05,0,0.00040425482438877225,1,0.9923833012580872
,,,RACIAL DIFFERENCES IN SOCIAL AND POLITICAL PARTICIPATION: IT'S NOT SIMPLY A MATTER OF BLACK AND WHITE,None,https://www.jstor.org/stable/42859520,Social Science Quarterly,10.2307_42859520,Sociology,1975.0,0,5.575907835009275e-06,1,0.9999364614486694,1,0.9995083808898926
,,,Structural Pluralism and Life Expectancy in Less-Developed Countries: The Role of Women's Status,"This study replicates a previous finding for the U.S. counties that showed a strong association, net of controls between ""structural pluralism"" and lower mortality. ""Structural pluralism"" refers to a community's capacity for political competition, and is a core element of ""democracy."" Pluralism has this effect because it facilitates the acquisition of appropriate medical facilities and because it tends to optimize the biological functioning of the residents. Working from a major component of pluralism, minority participation, this hypothesis is tested by showing that women's status in less developed countries improves life expectancy net of controls. A path analysis demonstrates that the structural dimensions work through health organization as an intervening variable, and the future testing of biological optimization is outlined. Location in Africa south of the Sahara is a partially unexplained control variable that has a powerful negative impact. Interpreting women's status as a component of pluralism explains why it predicts increased life expectancy for all citizens, not just women. It is a global dimension that affects all the members of a community.",https://www.jstor.org/stable/27526953,Social Indicators Research,10.2307_27526953,Sociology,2001.0,1,0.5359048247337341,1,0.8815276026725769,1,0.9992590546607971
,,,Ethnic Heterogeneity and the Enforcement of Environmental Regulation,"We examine the relationship between the administrative enforcement of environmental regulation, ethnic heterogeneity, and other community characteristics in New Jersey and New York. We find that the percentage of non-white population in a community is positively related with administrative penalties imposed on violators. However, penalties are lower in more ethnically diverse communities. This result may be due to the fact that these communities are less likely to coordinate to create solidarity across ethnic groups and demand stronger enforcement.",https://www.jstor.org/stable/29770388,Review of Social Economy,10.2307_29770388,Sociology,2006.0,0,2.0846709958277643e-05,0,0.00018205458763986826,1,0.9998140931129456
,,,Child Support in Black and White: Racial Differentials in the Award and Receipt of Child Support during the 1980s,"Objective. Black mothers living with own children whose fathers reside elsewhere are far less likely than white mothers to have a child support award and to receive payments due them. The purpose of this paper is to explain these large racial differentials in child support. Methods. This research analyzes data from the first four child support supplements to the Current Population Survey, 1979-86, to assess to what extent racial differentials in awards and receipts can be explained by racial differences in parental characteristics. Results. Racial differentials in award rates can be fully explained by the higher incidence of out-of-wedlock births among black mothers and the lower incomes of black men. By contrast, racial differentials in receipt rates and amounts are not fully explained by these and other socioeconomic factors. Conclusions. Unexplained differentials in child support receipts result from behavioral differences by race and perhaps from unequal treatment by or access to the child support system. Increased resources by state child support enforcement offices directed towards black mothers may well be warranted.",https://www.jstor.org/stable/42863500,Social Science Quarterly,10.2307_42863500,Sociology,1996.0,0,1.036464800563408e-05,0,0.026607085019350052,1,0.9981114864349365
,,,Why the Poor Play the Lottery: Sociological Approaches to Explaining Class-based Lottery Play,"Why do the poor spend more on lottery tickets than their wealthier and better educated peers? While social scientists generally agree that there is an inverse relationship between socio-economic position and patterns of lottery play, there is debate on what factors cause lottery gambling. Using survey data from a nationwide probability sample, we test three sociological approaches – socio-structural, cultural and social network accounts – to explain why the poor play the lottery. While controlling for cognitive bias theory, we find that peer play, educational attainment and self-perceived social deprivation have strong effects on lottery play. Culture, the study finds, plays a much lesser role. Although lottery players demonstrate fatalistic value orientations, it is not a lack of a 'Protestant' work ethic that makes the poor spend proportionally more on lottery tickets. The findings of this study generally point to the importance of social structures in explaining lottery gambling.",https://www.jstor.org/stable/24433691,Sociology,10.2307_24433691,Sociology,2013.0,0,0.0008290309342555702,1,0.9790961742401123,1,0.8276422023773193
,,,A Profile of Familial Relations among Three-Generation Black Families,"This profile of demographic structure and family relationships among a national sample of three-generation black American families revealed important variation across generations in several key demographic (e.g., age, gender, marital status, socioeconomic status, and region) and family (e.g., affection and support) factors. The findings are discussed in relation to current demographic trends affecting the generational age structure of American families and the implications of these changes for practice with multigeneration families.",https://www.jstor.org/stable/585563,Family Relations,10.2307_585563,Sociology,1993.0,0,2.2855441784486175e-05,0,0.0015411099884659052,1,0.9977253079414368
,,,Gender remix: On gender constructions among children of immigrants in Norway,"Values and practices regarding sex and gender are among the most fundamental constituents of a society's symbolic system, as well as of an individual's self. Gendered ways of behavior are symbolic markers of ethnicity, both in a process of labeling from the outside and in the construction of a subjective identity. Based on interviews with children of immigrants from patriarchal societies living in Norway — one of the countries in the world where gender equality has reached furthest — the article reveals the tension they experience between the ways gender issues are dealt with in their families and in the surrounding society. Their gender constructions can not be understood solely in the light of cultural influence, as if on a scale running from conformity to parents' culture to conformity to Norwegian culture. There is something really new in the making — new combinations and new creations — reflecting the particular social situation of the young people of immigrant origin. Feelings of obligations and debt toward the parents are strong, as well as the adherence to traditional family values. Still, there is clearly a tendency that ideas about individual rights, such as women's and children's rights to decide over their lives, are gaining influence.",https://www.jstor.org/stable/23889941,Ethnicities,10.2307_23889941,Sociology,2002.0,1,0.9769807457923889,0,0.00022892166452948004,1,0.9876074194908142
,,,PREMARITAL SEX: ATTITUDES AND BEHAVIOR BY DATING STAGE,"Using data gathered from a sixty-three item dating and mate-selection questionnaire completed by two hundred and eighty student and nonstudent respondents, this study investigates the differences between what people believe is proper premarital sexual behavior, what they do and what they think others are doing at five stages of dating. We find that individuals are most restrictive in what they believe is proper conduct, more permissive in their reported behavior and most permissive in their perception of what others are doing. During the early stages of dating, males and females differ widely in their outlook as to what is proper behavior and also in their reported behavior. Other studies which failed to take dating stage into consideration may have missed important gender differences in the early period of dating. With love and commitment the attitudes and reported behavior of females becomes as permissive as those of males. This is true for light petting, heavy petting and intercourse. Only with regard to oral sex do we still find significant differences between males and females even in the latter stages of dating. In addition to gender, this study examines the influence of the following factors on premarital sexual attitudes and behavior: age, father's education, mother's education, college status, residence, religion, nationality, attendance at religious services and religiosity. Only the last two variables are found to be statistically significant. Frequent attendance at religious services and holding religious beliefs to be important were associated with more conservative sexual attitudes and behavior. In sum, we find that in our analysis of social factors only religious and gender-role socialization affect premarital sexual attitudes and behavior. The latter'a influence varies significantly by dating stage. Lastly, we find that a majority of our respondents (71 percent of the males and 66 percent of the females) verbally support cohabitation, and a substantial minority (24 percent of the male and 18 percent of the females) have lived with someone of the opposite sex. The results of this study suggest that the liberalization of premarital sexual attitudes and behavior documented by numerous studies in the 1960s and 1970s shows no sign of abatement in the 1980s.",https://www.jstor.org/stable/41430916,International Journal of Sociology of the Family,10.2307_41430916,Sociology,1984.0,0,0.0016679076943546534,0,0.00018615988665260375,1,0.9568935036659241
,,,"A Test of the ""Deviant Deviance"" Hypothesis",None,https://www.jstor.org/stable/2136645,Journal of Health and Social Behavior,10.2307_2136645,Sociology,1983.0,1,0.8803989291191101,1,0.7710105776786804,1,0.9997031092643738
,,,WOMEN'S SOCIAL CLASS IDENTIFICATION: DOES HUSBAND'S OCCUPATION MAKE A DIFFERENCE?,"Research into social stratification has tended to concentrate on working-class men; there has been little on the middle classes, and even less on women. This paper looks at the class position and class images of 342 working married women in social grade Cl, drawn from a national survey of class images conducted between 1981 and 1984, to assess the extent to which these women's class identification is determined by the occupation of their husbands and the way in which the middle and working classes are perceived by women in same-class and cross-class marriages. It is concluded that a woman's class identification is determined at least in part by her own characteristics rather than her husband's, with education being a particularly important variable.",https://www.jstor.org/stable/42854386,Sociology,10.2307_42854386,Sociology,1987.0,0,0.008042175322771072,0,0.4963168501853943,1,0.999395489692688
,,,Meat as a Bad Habit: A Case for Positive Feedback in Consumption Preferences Leading to Lock-in,"The concepts of path dependence and lock-in have received growing acceptance but have generally been thought of as driven by positive feedback on the supply side of the economy. A case through example is made here of how endogenous preferences positive feedback in utility from consumption, social considerations, and institutional considerations can all lead to path dependence and the persistence of suboptimal consumption choices. The case here specifically relates to meat consumption and utilizes behavioral, institutional, as well as neoclassical approaches to justify the conclusion. It is argued that increased meat consumption, which at one time may have had positive value, has developed increasingly negative consequences both at the individual and social level. Negative impacts include health consequences, low production efficiency, and environmental damage, among others. Nevertheless, preferences for meat are maintained by multiple factors including historical dependence of tastes, socially established meanings of consumption choices, and institutional inertia.",https://www.jstor.org/stable/29770418,Review of Social Economy,10.2307_29770418,Sociology,2007.0,0,0.364230215549469,0,0.004481086507439613,0,0.0024427350144833326
,,,Nurture and Work in the Middle Class: Imagery from Women's Magazines,None,https://www.jstor.org/stable/20007062,"International Journal of Politics, Culture, and Society",10.2307_20007062,Sociology,1992.0,0,0.024639880284667015,0,0.48922011256217957,0,0.19140921533107758
,,,hiking the west bank,None,https://www.jstor.org/stable/24710339,Contexts,10.2307_24710339,Sociology,2015.0,0,0.006883535534143448,0,0.00017719889001455158,0,0.09370092302560806
,,,"Silence, Death, and the Invisible Enemy: AIDS Activism and Social Movement ""Newness""","Examining the dynamics and activities of the AIDS activist movement--here, through an analysis based on a participant-observation study of the AIDS Coalition to Unleash Power (ACT UP) in San Francisco--provides an opportunity to clarify issues on which social movements literature tends to be hazy. ACT UP mixes strategic action and material targets with expressive action and cultural targets; their cultural activity takes the form of boundary-crossing and the contesting of images. They often have difficulty distinguishing their targets, and are caught both denying and affirming that AIDS is a gay disease. I argue that these actions and dilemmas are best understood in the context of changed forms of domination, more and more an invisible and disembodied process of ""normalization,"" with the state gradually less directly involved. This argument not only explains the particulars of ACT UP's activism, but also poses challenges to theorizing on contemporary (""new"") social movements.",https://www.jstor.org/stable/800820,Social Problems,10.2307_800820,Sociology,1989.0,1,0.9987855553627014,0,0.00026336961309425533,0,0.0014532966306433082
,,,Wangari Maathai and Kenya's Green Belt Movement: Exploring the Evolution and Potentialities of Consensus Movement Mobilization,"Social movement research has traditionally focused on conflictual, overtly confrontational approaches to addressing social problems. Consensus movements, such as grassroots self-help movements in the countries of the South, have only recently been studied. Whereas some of these movements employ contentious strategies to influence traditional political arenas and actors, others intentionally remain outside traditional political spheres and use consensual means to achieve their social change objectives. Utilizing Kenya's Green Belt Movement as an example, I argue that consensus strategies present opportunities for movement formation and development in repressive environments. Likewise, the domestic momentum and international exposure generated from consensus action can provide future opportunities for expanding the movement's tactical repertoire.",https://www.jstor.org/stable/3096988,Social Problems,10.2307_3096988,Sociology,1994.0,0,0.039555806666612625,0,0.0016258514951914549,0,0.0004476163594517857
,,,POLICING THE DEAD: A SOCIOLOGY OF THE MORTUARY,"This paper focuses upon the nature of the mortuary as a socio-medical institution and the discourse of pathology which operates within it. More specifically, by examining the manner in which pathology is operationalised in Belfast it demonstrates: (i) how medical interests are frequently fused with those of the wider politico-technological system within which they are ensconced; (ii) how the assumptions and investigative principles of pathology are grounded in social rather than specifically clinical concerns, and (iii) how the subject population on which pathology concentrates is selected in accordance with social as well as clinical characteristics.",https://www.jstor.org/stable/42853997,Sociology,10.2307_42853997,Sociology,1987.0,0,0.00026015692856162786,0,0.0002895470825023949,0,0.0005058004753664136
,,,Trends in Public Sector Employment and Earnings: Part One,None,https://www.jstor.org/stable/3516689,Social Scientist,10.2307_3516689,Sociology,1980.0,0,1.6641593902022578e-05,0,0.00095888547366485,0,0.0007999208755791187
,,,The Depoliticization of the Liberal Arts,None,https://www.jstor.org/stable/40971227,Social Research,10.2307_40971227,Sociology,1982.0,1,0.9998904466629028,0,0.00017027017020154744,0,0.00021438102703541517
,,,Engendering Response: Professional Gesture and the Assessment of Eyesight in Optometry Consultations,"Many of the procedures undertaken within healthcare require specialized forms of participation that may be unfamiliar, even disturbing, to patients or clients. The practitioner has to encourage and enable participation in the investigation in an appropriate fashion while preserving the structure and integrity of the procedure. In this article, we consider optometry and the deployment of a vision test, known as subject refraction, that provides data to help determine the characteristics of any corrective lens that may be required by clients. The procedure's ability to establish robust and reliable data relies upon the optometrist's ability to encourage the client to respond to a series of stimuli without consideration or reflection. That is, the client is required to produce an unwitting response—conduct that might be considered nonsymbolic rather than symbolic. In this article, we also consider the optometrist's talk and bodily comportment during subjective refraction and how it serves to shape and determine the quality of the client's response and participation, and in turn to produce reliable test results.",https://www.jstor.org/stable/symbinte.36.2.137,Symbolic Interaction,10.2307_symbinte.36.2.137,Sociology,2013.0,0,0.00022726102906744927,0,0.0028045279905200005,0,0.0001990762393688783
,,,"Dueling Histories: Charles Fairman and William Crosskey Reconstruct ""Original Understanding""","Historiography and epistemology are two subjects not often brought together in sociolegal studies. This article takes reconstructions of legal history as a subject of sociological investigation. The institutional ""acceptability"" of any historical representation is a complex social achievement since there are no objective criteria for verifying historical accounts. I juxtapose two competing reconstructions of Fourteenth Amendment history, by legal scholars Charles Fairman and William Crosskey, and examine how both reconstructions took place with reference to preexisting interpretive frameworks. I also examine the social and institutional settings in which these histories interacted and competed for credibility. The Fairman/Crosskey dispute served to socialize future participants in Fourteenth Amendment debate. With the Fairman/Crosskey exchanges, battle lines were drawn and topics of debate were established.",https://www.jstor.org/stable/3053961,Law & Society Review,10.2307_3053961,Sociology,1996.0,1,0.9998418092727661,0,0.00011384706886019558,0,0.0011798053747043014
